{
  "claim_id": "c71d4248-0e0c-41be-a5d1-7f31206d5614",
  "vehicle_id": "a1b2c3d4-e5f6-7890-abcd-ef1234567890",
  "policy_id": "c4632682-d406-3102-86b7-6a22ef09af5d",
  "claimed_cause": "mechanical_failure",
  "triage_decision": "MANUAL_REVIEW",
  "triage_reasons": [
    "Claimed cause is 'mechanical_failure'.",
    "Vehicle has a clean service record within the last 90 days.",
    "A recent clean service contradicts an immediate mechanical failure \u2014 manual verification required."
  ],
  "triage_reason_codes": [
    "mechanical_failure_claimed",
    "recent_clean_service"
  ],
  "maintenance_signal": "clean service within 90-day window.",
  "submitted_at": "2026-10-21T04:58:04.649781204Z"
}